{
  "displayName": "OT-3",
  "robotType": "OT-3 Standard",
  "models": ["OT-3 Standard"],
  "extents": [477.2, 493.8, 0.0],
  "paddingOffsets": {
    "rear": -177.42,
    "front": 51.8,
    "leftSide": 31.88,
    "rightSide": -80.32
  },
  "mountOffsets": {
    "left": [-13.5, -60.5, 255.675],
    "right": [40.5, -60.5, 255.675],
    "gripper": [84.55, -12.75, 93.85]
  }
}
